### ISSUE TITLE
perf: investigate pgwire flushing

### ISSUE THREAD

**Issue by petermattis** [cockroachdb/cockroach#17159]
Investigate whether pgwire is doing the appropriate flushing of buffered data. Excessive flushing can result in extra system calls and extra TCP packets. This basically amounts to looking at `tcpdump` output and verifying that it is sane. Inspired by the discovery that gRPC currently creates 3 packets for unary RPC responses.

**Comment by petermattis** [comment]
First check shows nothing interesting:

```
01:41:45.239568 IP 192.168.1.10.53264 > 192.168.1.4.26257: Flags [P.], seq 27073:27156, ack 24788, win 273, options [nop,nop,TS val 964036717 ecr 2710126488], length 83
01:41:45.241507 IP 192.168.1.4.26257 > 192.168.1.10.53264: Flags [P.], seq 24788:24866, ack 27156, win 279, options [nop,nop,TS val 2710126488 ecr 964036717], length 78
01:41:45.241691 IP 192.168.1.10.53264 > 192.168.1.4.26257: Flags [P.], seq 27156:27239, ack 24866, win 273, options [nop,nop,TS val 964036718 ecr 2710126488], length 83
01:41:45.243786 IP 192.168.1.4.26257 > 192.168.1.10.53264: Flags [P.], seq 24866:24944, ack 27239, win 279, options [nop,nop,TS val 2710126489 ecr 964036718], length 78
01:41:45.243883 IP 192.168.1.10.53264 > 192.168.1.4.26257: Flags [P.], seq 27239:27323, ack 24944, win 273, options [nop,nop,TS val 964036718 ecr 2710126489], length 84
```

`.10` is the client and `.4` is the node it is talking to. We're seeing 1 packet in each direction. Request and response.

**Comment by petermattis** [comment]
I'm not aware of anything else to be done here. It looks like we only flush when necessary. The tcpdump confirms this.
